{
  "task_id": "task_YYYYMMDD_HHMMSS_slug",
  "task_type": "browser_check",
  "created_at": "2026-04-02T12:00:00Z",
  "requested_by": "user",
  "status": "draft",
  "inputs": {},
  "constraints": {
    "safe_mode": true,
    "allow_direct_source_of_truth_write": false
  },
  "expected_outputs": [
    "run_log",
    "report"
  ],
  "approval_gate": {
    "required_for_truth_apply": true,
    "approver_role": "human"
  },
  "source_refs": [
    "source_of_truth/README.md",
    "source_of_truth/master_state.md"
  ]
}
